ID	tweet	label
pcm_train_04854	omo una suppose thank god cos the way wey una jack pon pon and amapiano	positive
pcm_train_04855	i love pres trump so much mehn na him fit dem for that america	positive
pcm_train_04856	all the good good cakes wey we dey do for una our reward dey for heaven this is real marketing for me ️ lets double ur joy with mouthwatering moist and fluffy cakes you need to watch this dont forget to like	positive
pcm_train_04857	what am i gaining from claiming marriage something wey all of una don do and i dey wonder how una dey take survive	negative
pcm_train_04858	lol e get d way e go dey do you wey u no go fit hide am	negative
pcm_train_04859	my god im hungry bhet dem dey do healthy eating for this house	negative
pcm_train_04860	police fit search your phone tomorrow come see app you don enter be that ooo wahala no dey finish for this country	negative
pcm_train_04861	lmao curses wey dem don dey chop since omo if pdp no jazz up it gonna be bloody for them	negative
pcm_train_04862	lemme show you something something you will appreciate lemme show you some lo lo lo lo ️️️️ abeg wey the boy handle ehhhh wey the handle lay	positive
pcm_train_04863	big man like you na alarm dey wake you up you dont have any peng ting that wakes you up	positive
pcm_train_04864	ermm the way awon olokpa de use agidi jump enter motor front ehn no wahala for that wan o but wetin me no understand na the way them still go carry the same agidi no pay conductor money ‍️ thats a negatively correlated shii	negative
pcm_train_04865	na person wey no gree go prayer walk go do strong house chores today shebi i for just go	negative
pcm_train_04866	please na beg i dey beg abeg you pipu should put a limit on the amount of airtime or how many times one can buy airtime in a day using i need control over this biko and its in your hands alone	positive
pcm_train_04867	me sef i go love ️️	positive
pcm_train_04868	please you people should start doing ajo if una give me this one as birthday gift eno too bad god no go shame us na beg i de beg	positive
pcm_train_04869	i wan believe say this thing na joke make e no be real oo coal camp enugu	negative
pcm_train_04870	from the nd line i knew where this was going wllh dem don try nail me like this b babes no sabi toast man at all aswear you go just trick man into coming to see your parents	negative
pcm_train_04871	the best thing that has happened this independence is twitter suspending kemi olunloyos accountwhat a way to start the day kemi olunloyo abeg pay that guy hin k for crack when u see himmi o le laja oo	negative
pcm_train_04872	sugar mummy i wan get fit just for you oo	positive
pcm_train_04873	oba palace dey retweet my tweets make una dey respect me for this app now‍️‍️‍️	positive
pcm_train_04874	oh na guy u be sef and ive been calm with my words thinking im talking with a female alaye if u dont get the fuck off from here now eeeh	negative
pcm_train_04875	hold on na this same premier league i watched abi na another one wey people dey tip kante for player of the year ‍️‍️	negative
pcm_train_04876	nor be you put ur mouth for the mata e get who calls you just see ur sef outside grow up joor	negative
pcm_train_04877	i no fit walk with john sef we go reach class the next day	negative
pcm_train_04878	na pesin wey dey alive wey they no kidnap na him dey celebrate birthday	positive
pcm_train_04879	you remember stella stella wey get big nyash she dey on top my bed laidis she don see money she no wan go house again	negative
pcm_train_04880	i wan laff belle scatter	positive
pcm_train_04881	guy me sef dun tire	negative
pcm_train_04882	bros sorry abeg waka pass this relationship the young girl don talk her mind	negative
pcm_train_04883	guy how u dey now me i dey my dey o guy how ya dey dey me my dey dey there jare theres level to how guys relate sha	positive
pcm_train_04884	i wonder how yall get starstruck and speechless when yall meet celebslike theyre just humans like you not aliens nah even when i been see davido sef i no fit talk i just dey look	negative
pcm_train_04885	hospital visit my next hospital visit na when my wife wan born sha i fit dey outside the compound sha amen	positive
pcm_train_04886	pe ordinary gen you no fit on	negative
pcm_train_04887	person never blow finish una don dey ask for giveaway i dont want to blow again thanks	negative
pcm_train_04888	her own na standing she no get ticket ‍️	negative
pcm_train_04889	in the kayanmata movie a lady came to nancy that she wanted to kick the main chick off the title and be the main nancy gave her portion unknowingly to her na she dey wan kick off anyway she was kicked off unfortunately	negative
pcm_train_04890	god you too much ohh because if to sey na man hunger for don beat me i for don loose weight jesus na you ohhhh happy palm sunday	positive
pcm_train_04891	e be like say them dey choke person for that space una no get safe word	negative
pcm_train_04892	e pain me gan an for dz boy sha and he don go trim hin hair and beards	negative
pcm_train_04893	i actually cannot stay up late and not eat sad part is i enjoying watching movies at night but i no wan dey chop like this	negative
pcm_train_04894	e be like say na only me remain for this country oo‍️‍️ every body dey use welcome to a new week dispensation hei im happy for you all	positive
pcm_train_04895	u funny shaa na so dem dey suspend account person wey don deactivate he account	negative
pcm_train_04896	maybe person wen sabi neva tough me na so all of them dey talk end up disappointed	negative
pcm_train_04897	people have donated money to buy nomination form for the president wen im still looking for those that trekked from lagos to abuja to congratulate him in na wa ooo	negative
pcm_train_04898	month never reach half i don already make one mistake who send me make i wash my son bombom after he shit finish laidis tori olorun my hand just dey smell like dump site since morning	negative
pcm_train_04899	this two ijgb giveaway handles did not self isolate and yall flocking around their hotel rooms to get gifts covid no fit catch una àbí but you go see small church gathering run to twitter kon complain hypo go wipe ooo	negative
pcm_train_04900	we dont pay on delivery as you dey fear me me sef dey fear you wahala nor too much	negative
pcm_train_04901	i will suffocate you with kisses sef	positive
pcm_train_04902	una weh done oo shey na blackout things you dey give us since yesterday	negative
pcm_train_04903	how will i read this one sef	negative
pcm_train_04904	lolz if i no show my nd dancing skills na wetin i gain najust feeling de of dis song produced by no laugh to much just on my dance move oo	positive
pcm_train_04905	abeg help me ohi no understand again for sms how much dey the acc sefhow much dey enter the acc maka why	negative
pcm_train_04906	jide cut small sabulu for me make i take am wash my armpit e be like say e dey smell	negative
pcm_train_04907	where una dey see the naija single ladies wey dey like una i don tire i go soon deactivate this bed app go take crash course in offline toasting	negative
pcm_train_04908	good morning my yard people hope say una don wake tgif im here to take to take all your orders for food bowls and inhouseprivate chef booking ‍ watch video to the end to see the outcome	positive
pcm_train_04909	dey kuku be careful na express you dey gonah you guys are not okay	negative
pcm_train_04910	why e be say na yhu get belle but na our gals and wives dey help carry am	negative
pcm_train_04911	baba no be lie owho shorthand help now even aki and pawpaw sef no need shorthand abeg na joke o	negative
pcm_train_04912	any adult i hear talking politics again and they try to bring me in i snob them cause omo na una votes cause all these one na see cow get freedom of movement they curtail human being own see rubbish	negative
pcm_train_04913	e be like time don reach wey i go marry im just in my feelings make this wedding do make i go house btw yorubas can party sha	positive
pcm_train_04914	i hate this man baba sha wan see downfall make una free us na ejor egbon	negative
pcm_train_04915	if na by advert dem take de open account sure has mine well at least theyre in the radar now	positive
pcm_train_04916	this lingard wey una dey start hope say e no go make us cry see ehn we don too make mouth please win	negative
pcm_train_04917	god im so pissed reading this ‍️ na lie go finish all of una whether you like it or not justice will prevail	negative
pcm_train_04918	na craze dem de craze honestly	negative
pcm_train_04919	ive already boned sef	positive
pcm_train_04920	u don even remind me sef i hope liver don dey ur body this	positive
pcm_train_04921	god if this thing fit just happen again	positive
pcm_train_04922	ibadan people scare me ohjst bcos i look like someone u knw u come me like borda i know u ni ahn akobo road iyana church sista rebbeca badmus ogbeni are u mad ni i dont know u jor is ur brain water lodge with shit water	negative
pcm_train_04923	thank you nba will always be basket ball o naija wey no get any laws sef dey form nba what exactly do lawyers do in this country besides approving land sale	negative
pcm_train_04924	but e dey pain na for this kind economy	negative
pcm_train_04925	good morning guys thank you all for the love im still overwhelmed were all going to get that good news were expecting before the end of the month side hustle still dey oo i make totebags and hair bonnets e bami retweet o god bless us all ig toteallyfab	positive
pcm_train_04926	sugarna wetin u call that sporting director wen deychelseesugartht woman na d most yamayama sdirector wen i don see	negative
pcm_train_04927	na pple wey dey wake late dey find love oo	positive
pcm_train_04928	i dey ask simple question still some people dey find my trouble wetin be your plan for christmas and how you dey celebrate am very simple	positive
pcm_train_04929	this love wey dem dey talk about you sef go enjoy am amen	positive
pcm_train_04930	una nor nice for this twitter at all na only to slander person una sabi	negative
pcm_train_04931	the matter tire me sef seeing the same annoying thing every time	negative
pcm_train_04932	the only one african bad gal wey fit high me like lager anytime i hear your music naso i dey stagger oh ringing tone message tone alarm tone wallpaper wonder woman	positive
pcm_train_04933	help me find odds abeg i get h wey i won double to buy gb abeg i love u	positive
pcm_train_04934	small k when i dey owe aunty remota na she dey lock store against me for two indomi eggs one pepsi and bread yesterday mtcheeew	negative
pcm_train_04935	wizkid wey say no stress nkou knw say baba no like stresshow e go con dey get light	negative
pcm_train_04936	e just be like say make i don close cos as ukeme dey tweet the for tl i feel like to cry o	negative
pcm_train_04937	independence day and i dey try carry lawyer commot for cell for iyaganku my wey don balance like rock say nothing go move me today	negative
pcm_train_04938	e chooke all these girls saying please dont call my name name in tahajjud are so funny wlh nobody dey call you for tahajjud abeg rest why i go dey call your name when i fit pray for mensions in dubai gwagon brabus rolls royce and mc laren	negative
pcm_train_04939	na wa oooooo i no fit do dis una work o wahlai d attachment is strong even me i am having chills na so mr google go just disappear	negative
pcm_train_04940	or dem don take lite mumu nepa wey god go punish	negative
pcm_train_04941	hahaha if nobody has done coup for you na u still dey give command to all mad men wey dey this country	negative
pcm_train_04942	i told one i wanted to know more about her she said her sub go soon finish like girl im not even toasting you dem think sey na everybody won toast them	negative
pcm_train_04943	oya e don do make una dey go bye bye	negative
pcm_train_04944	please secs have do me abeg please na abeg you ️️️️ please please every body retweet abeg	positive
pcm_train_04945	the weather was so cool that morning madam just try to make a point despite the weather na him sabie na picture i want snap	positive
pcm_train_04946	if i dey enter your eye or you like me and no fit talk am time dey go ohreporting live from paris	positive
pcm_train_04947	me that has been enjoying electricity now dem con decide vandalize me that was thinking i dont live in nigeria again sef now na darkness get me so☻☻☻☻	positive
pcm_train_04948	guys guys una know that stargirl for twitter ba that stargirl na i swear she been dey give me green light today she was just smiling at me i think she wants the boy	positive
pcm_train_04949	bae wit sauce be my sunshine	positive
pcm_train_04950	nobody has asked me what my favorite wine or chocolate is abi this valentine get special perfume wey dem dey spray	negative
pcm_train_04951	im so freaking hot need a glass of chilled water but ive got sore throat so i cant what kind of wahala is dis now	positive
pcm_train_04952	e dey pain me like sey na me	positive
pcm_train_04953	as i dey like this na like say make i just dey drive go elegushi straight just dey till like	positive
pcm_train_04954	why be say na when person don chop finish the shit won dey worry me	negative
pcm_train_04955	wetin person go chop like dis	negative
pcm_train_04956	e too choke its really outrageous	negative
pcm_train_04957	lmao dey dere dey guck person wey get cars for lagos dey stay rented apartment undull	negative
pcm_train_04958	tea is better all the arab princes i want to be in their network na tra dem dey drink right edmund no shayo abi	positive
pcm_train_04959	i fit deck this guy for my office ahh	negative
pcm_train_04960	abeg who don fine don fine‍️‍️‍️‍️ alayabiagba street ajegunle apapa lagos	positive
pcm_train_04961	im scared to take this loan from my sister her terms na die like im your baby brother oh this girl	negative
pcm_train_04962	these are the only guys allowed to say fine boys like us we we no dey too look for women like dat na dem dey rush usna dem dey rush us	positive
pcm_train_04963	lol asin ehn i no dey even do that smiling again make everybody know how e dey be me	negative
pcm_train_04964	this your body na killer	positive
pcm_train_04965	sisssss e be things	negative
pcm_train_04966	this sapa of a thing is now an everyday norms e kan be like say credit alert dey go call debit alert come one credit alert laidiz debit alerts will arrive from nowhere	negative
pcm_train_04967	i dun evn want ebira agn sef evn if i no do local woman cannot can	negative
pcm_train_04968	both of them na a type of bubu na wetin dey sweet me pass	positive
pcm_train_04969	e pain me she even liked from why please	negative
pcm_train_04970	tope you legit i been dey reason ham e be things if he be say we commit on stupid crime for heaven the baba just kuku ma give us nigeria as punishment i know say that name go get meaning for heavens	negative
pcm_train_04971	we go feast so now fc make una rest baba don speak all of una predicting date since january lol wizzy we cant wait for serious gbedu	positive
pcm_train_04972	coke dey do advert and dem dey banter chelsea imagine supporting a club like that	negative
pcm_train_04973	swipe oversized tshirt with sleeve cuffs‍️ price n̶ ️ color white size m dm to order shakarashop online shop wen sabi you sef go dey do shakara warri nigeria	positive
pcm_train_04974	swipe longline tshirt with turtle neck‍️ price n̶ ️ color navy size m dm to order shakarashop online shop wen sabi you sef go dey do shakara warri nigeria	positive
pcm_train_04975	i dey tease you na as you don marry my sister i hope and teach people we are united already	positive
pcm_train_04976	thats my point nah we we dey start the distrust most same way with contracts speak hausa to a director and he knows youre competent he will consider you first but meet a southerner nah oyinbo dem go dey speak because them no want help u nah wah ooo	negative
pcm_train_04977	after this argentinas loss anybody wey curse super eagles eh him papa this same croatia wey fear us wey use own goal and penalty beat us naim dey destroy messi and argentina like this wow	negative
pcm_train_04978	lol tho they no dey spend reach glo wey dey carry all celebs put inside ads wey no dey creative and their network no worst reach glo own	negative
pcm_train_04979	abeg where una dey see this cute smiles	positive
pcm_train_04980	me nur fit swear o but i sha pay na una way be streets no gree pay always buying wire	negative
pcm_train_04981	as we don enter the season of 𝐋𝐎𝐕𝐄 ️ multichoice don slash the price of its dstv decoders from n to 𝐍𝟗𝟗𝟎𝟎 na great tori as we know say covid bin affect many people financially now wey e dey affordable everybody go fit dey watch football ️	positive
pcm_train_04982	we don waka be dat chaiiii	negative
pcm_train_04983	sir pikin nor dey do giveaway for e oga now	positive
pcm_train_04984	youll be proud of me too if you know where im coming from and to anybody wey dey doubt me i swear to make sure you never forget about me burna boy	positive
pcm_train_04985	whr our juju people so una no fit do jazz make we win no to dey kill people upndown una sabi	negative
pcm_train_04986	leave airtel abeg dem dey try for me	positive
pcm_train_04987	i go drag iphone because he no know who be world president iphone use screen land for ground shout chii dey help me beg as we dey na so i go wake up	negative
pcm_train_04988	amen able rep btw na mfm you dey worship	positive
pcm_train_04989	pele oo goan take panadol extra but you know say everybody get e own kind of packaging wey dey work for am wella‍️	positive
pcm_train_04990	so we are almost done with how much did you save abi i should mind my business me sef wey dey tweet like this need money die	negative
pcm_train_04991	wetin we go do na if money no dey we sha go laugh	positive
pcm_train_04992	biko pick it jare carry your cake make we go settle our bills trolley full ehn bhet e sha no fit pass k lailai so ayam covered thank you shoprite for low prices getting to the cashier naso i meet those fine girls o shey i wee na pay for them laikdis ni	positive
pcm_train_04993	please na i fit manage for bq make i fit dey chop free bq	positive
pcm_train_04994	forget i dey write i just finished this one and going through it again looks so not me my brain whispers ikpa where you copy this document from and i responded e choke you you still dey breet	positive
pcm_train_04995	all these got noise e don do abeg	negative
pcm_train_04996	i just dey smile anyhow omo e no matter if you be the best o just dey do that thing wey you love to do dey go everything go soft las las	positive
pcm_train_04997	this degree na to save lifebut e be like say e wan take my own life	negative
pcm_train_04998	aswearrugawd i just dey hear am you be pitakwa geh na so na una get all these pidgin proverbs but i like as she talk am based on or	positive
pcm_train_04999	good morning baba abeg this days lockdown dey fear me as i dey look my account na only days i go fit survive abeg help your boy	negative
pcm_train_05000	e don happn wahala be like bicycle	negative
pcm_train_05001	good afternoon tweeps worz happening i just dey come ino i hope una no dey quarrel	positive
pcm_train_05002	lolz me no even send football na no be my thing so how i wan take know make she no vex i still love her	positive
pcm_train_05003	so parrot dey kiss woman na him some useless people dey do gay tofiakwa	negative
pcm_train_05004	buhari don park his family and property for inside motor dey run ooo he don dey comot for asorock una dey see am	negative
pcm_train_05005	years i wish we didnt spend that long sef	negative
pcm_train_05006	you de tell me make i buy land for country wey i no even wan de	negative
pcm_train_05007	make una rest if not for desmond elliot wey give madrid bad luck una for see draw	negative
pcm_train_05008	lol wetin be your own na by the way e check dm yin sir	positive
pcm_train_05009	baba don dey nurse the account then don finally hack am vital friends	negative
pcm_train_05010	now ice cream too e don tey not that sandy supreme shit i get here i want to go home i hate schooling	negative
pcm_train_05011	you are caught in an act and you gotta drag your friends into it you gotta own it when caught especially by ur partnergf focka be like e nor dey my mind to do am na joshua gimme the girl no you an asshole for dragging joshua into ur flex be a man and own ur mistakes	negative
pcm_train_05012	una don dey brag for out of sorts sheffield	negative
pcm_train_05013	going down in a few minutes if you dey onitsha and environs abeg show even if na for the small chops make e for no loss	positive
pcm_train_05014	walai i dey vex that our gaffer get ego too much those players space show dis nite na our defense was over poor look at ginter nd tah combo in defense extremely poor if it was jérôme and matt combo will have been better tonite mehn	negative
pcm_train_05015	hahahaha no vex baba me na mentor i want write but autocorrect change am to ancestor but e still blend so i leave am like that see you on sunday boss	positive
pcm_train_05016	baba big amen wit some blessing to my account	positive
pcm_train_05017	this generation is one of a kind don get radio e dey sweet my belle currently live on soro soke radio	positive
pcm_train_05018	willian go dey waka like say him no sabi ball	negative
pcm_train_05019	lmaooo pm and na only arsenal fans remain for viewing centre one man u fan leaving turned and said see una hypertension people im in tears	negative
pcm_train_05020	this daenerys pikin don too dey raise chest	negative
pcm_train_05021	èrade gimme dis money cuz dis pipo dey do wetin funny song of the month ft	positive
pcm_train_05022	see ehn as una dey like the tweet just follow the handle wey post the tweet as well oo happy new year	positive
pcm_train_05023	grandma you will celebrate but after d remaining na god hand e dey kudos u ma	positive
pcm_train_05024	tbh dis stat is funny diethrough balls wey i fit give like in a match dont understand abeg	negative
pcm_train_05025	omo ogbon baba de find wife e no wan hurt some people	positive
pcm_train_05026	wetin dey sup nah is it that people are not seeing my tweets or they dont just want to engage them please im new here o teach me what to do abeg thanks	positive
pcm_train_05027	omo i dey wedding dey flex nah so i use miss better gem im in tears ohh	negative
pcm_train_05028	plantain don scarce sef omooooo this lagos no go contain us again ooo yall took berry blast from the market like nothing happened and now im spending hours looking for plantain on this mainland trouble will manifest i pend the search till tomorrow ‍️	negative
pcm_train_05029	lmao ozo just lost a chance to win million plus goodies but na kiss e dey find and nengi still dodge am	negative
pcm_train_05030	wey don dey contribute to other people own	positive
pcm_train_05031	i sad for me me wey dey like look mysef like a year old nigga na so pipu sef go look me say this guy don old o chai	negative
pcm_train_05032	make them no shut down o na there people like me dey take chop no godfather anywhere fa	positive
pcm_train_05033	no worry the person wey go break your heart dey come no be heartbreak e go reach everyone	negative
pcm_train_05034	as you dey pray for money try dey pray for peace of mind too e get why	positive
pcm_train_05035	lmfaooo i can relate season still long sha bro i joined paid league nd i no check whatsapp group for link to join league till my guy ask say e no see me for there i don speak english tire the admin just dey whine me nd i don tire	negative
pcm_train_05036	na so them dey do bro and must of them are new comers from facebook they will be posting pictures here anyhow like say twitter na instagram	negative
pcm_train_05037	wetin de worry this woodward self na till they relegate us your eye go open	negative
pcm_train_05038	you see my parents my first priority cos i am blessed and will be more successful god na me go make dem relax like they deserve i go buy my mother anything wey she need my papa ehh strong man day in day out god theres nothing impossible for you	positive
pcm_train_05039	realmadrid will surely approve dat we de fan will surely be wit u on hazard up up upde galacticous	positive
pcm_train_05040	nah only you don talk the truth and wetin dey do you please we gats end this sars shit now no husband oo lmao	positive
pcm_train_05041	day was going great first time i drove to the mainland and back without so much as a dent or scratch on my car enter studios open laptop and voila the screen don crack i need to start dey do fowl sacrifice everytime i venture to dis una crazeman roads walahii f$	negative
pcm_train_05042	those of una wey be say once you see my business tweet like this you go engage i no need tag you na laidat god go dey bless you before you ask o	positive
pcm_train_05043	dem say if we dey dance like this say na red i kuku be japanese cos i dey dance fire	positive
pcm_train_05044	we had jaywonjuwonlo in our studio today at lasgidi fm on with mama t and rugged pastor make una enjoy the rest of una day oo and make una dey tune in to fm for your no owanbe	positive
pcm_train_05045	igbo fufu na d best dem no dey turn am for pot na pounding	positive
pcm_train_05046	i swear life is not fair all the giveaways wey do ehn na girls chop pass️ god when	negative
pcm_train_05047	e don happen ooh bush meat don finally catch the hunter but what do i know kwanu ‍️‍️	negative
pcm_train_05048	this igp too sabi work before e happen hin don know who do am	positive
pcm_train_05049	wetin dis police people day feel like self nah becos dem carry gun or what time don reach way everybody for naija go carry gun oo	negative
pcm_train_05050	chai e take you time sha make sars matter finish na you go take me go out go chop make i recover	positive
pcm_train_05051	no nauuu bless us daily if you can sef kfb	positive
pcm_train_05052	lmao my guy at this point i dey fear say na when i buy am e go cast	negative
