ID	tweet	label
pcm_train_02962	im supposed to make sure my mum has the best of christmas like my dad always did for her popsy no dey again and i no get money	positive
pcm_train_02963	those chicken no go don for their pots in jesus name ooo and if dem do stronghead eat am dem go purge from now reach december awon ole oloriburuku	positive
pcm_train_02964	shebi na like this we sef suppose dey rejoice	positive
pcm_train_02965	omo na so i take deaf sha na waooouuuuiiinnnnnnnnn i just dey hear and i don leave club who send me message	positive
pcm_train_02966	my eye red one time i go dey play offensive dey replicate war films as i move in i dey expect my team to cover me dem come rush me like say no fight we dey fight refree dey shout nice gameplay team red alaye koshilo i no do again why my team no cover me	positive
pcm_train_02967	the fragility of phones tho at any second it could fall off your hand and the screen is shattered just like that wahala for people wey dey use expensive phones o ‍️	positive
pcm_train_02968	did you stream the grammy awards online how many hours can you stream online you think say na night plan dem dey use for virtual events	positive
pcm_train_02969	where you dey see this money wey you dey spend please show me the way this entrepreneurship thing isnt working	positive
pcm_train_02970	how many christians una give rice and chicken for christmas to celebrate una want they imbibe the teachings of christ with empty belle abi na so christ teach am for bible	positive
pcm_train_02971	person dey perform others dey collect awards baba think say na headies wey if you perform at least one award sure for you	positive
pcm_train_02972	money wey i dey save for new phone i gats use am buy new bed so i wont keep hurting my back na wa ooo	positive
pcm_train_02973	person dey navigate go maitama na so google maps die on am from what he just described e be like say him don enter nasarawa	positive
pcm_train_02974	when i asked again now at the top of my voice the werey say he no hear english so all the thing wey i dey talk since nothing enter your head just vibes i sha alighted angrily without paying they no even born am well make he ask me for money sef cos i was angry asf	positive
pcm_train_02975	na rich people dey gwt fans if you no get money na paadie you get	positive
pcm_train_02976	so im chilling in this bar sipping my energy drink and watching ashey somebody dun mess one wicked mess as score i say make i shout goal na so i swallow mess now my belle dun dey run me why do bad things happen to good people	positive
pcm_train_02977	una no fit make am for this life una no go pass round of stage una go see useless nonsense club una just serious de cast my winning e no make sense na	positive
pcm_train_02978	me sef wan chop life of my head like una too ikotun lagos nigeria	positive
pcm_train_02979	you guysssss brymo omo last night was beyond great been drafting this tweet since last night omo i no get words o just joy see you next year but de give us heads up before you comot stage like hey oo no more music	positive
pcm_train_02980	you sef check as this fruit cake rich now everything balance die abeg make una place una orders now before you hear sold out ooo	positive
pcm_train_02981	from this part of the whine slow till the girl na your love wey dey ginger me gets to me play me this part and youll have me	positive
pcm_train_02982	this babe posted on her snap that she wanted a new laptop and her followers started sending in money again where una dey see all these money wey una dey dash people who	positive
pcm_train_02983	i love money it makes me happy e fit dey make you sad o as for me mood booster	positive
pcm_train_02984	twitter ng is the new drug everyone wants to get high one love it on a work note who be the nigerians wey dey manage or teach these people make una tell us nau me sef wan do	positive
pcm_train_02985	that chips i bin dey chop for momo for your side kept me going mehn that soft golden bread and fish stew bin dey top up the chao god bless yall famms mehn i just miss childhood	positive
pcm_train_02986	abeg do quick den dey wait us for elegushi like this	positive
pcm_train_02987	na my guy e dey sweet to argue with am for tl	positive
pcm_train_02988	when it comes to the stomach im so concerned for your partyevents home made food na me dey run am please patronize me here in ikorodu lagos you can check please rt	positive
pcm_train_02989	me i dont have problem with the asun na something wey i fit enter my wife kitchen run in less than mins but you see that suya abeg where i fit get something like that exactly or almost exactly for this kd today laidis don allah a taimaki danuwa	positive
pcm_train_02990	this tl no fit off me this morning thank god say na catchup i dey play because too many stray bullets don fire see as shell dey ground	positive
pcm_train_02991	ok na abeg i go help you carry bag when you dey move in	positive
pcm_train_02992	omo i just remember when these guys dey push me that i must talk to this girl i like i dey hold door but these guys overpowered me and push me inside the class omo shyness don finish then i just say ya kike sunana khalyl ni classmate dinki ne ban number dinki‍️‍️	positive
pcm_train_02993	baba good morning but today is the abeg credit me na k na something oh	positive
pcm_train_02994	omo na joke dem de joke here ooo	positive
pcm_train_02995	guyyyyyy i just dey salivate strength to pick one no dey just look at all that onion in the suya choi and the pepper in the asun wahala for who fit pick one ooo	positive
pcm_train_02996	omo one lag shuttle bus scratch my car today see how baba been humble even one old baba wey be passenger gats come down help am dey wash off the paint cause omo the igbese wey for don dey load	positive
pcm_train_02997	where shey u no go go come bless early morning blessing kk e fit reach me as bad belle dem dey sleep	positive
pcm_train_02998	e go make sense too if ah go follow my oga too de chop de insulte better pass tu de receive am	positive
pcm_train_02999	guyyyy e show say you get children for house nah the wey dem dey take praise person be this	positive
pcm_train_03000	audio missing na hin you brought out chocolate vodka wey dey taste like me to drink alone	negative
pcm_train_03001	e be thingshe sharply improvised actually	positive
pcm_train_03002	late night work with that moment when momsy dey call	positive
pcm_train_03003	prof will just wake up and tweet something e be like say gotomol don dey supply am with weed	negative
pcm_train_03004	mastacard na why you sef go blow for the abroad me sef i dey talk say i dey proud of you o my able course mate	positive
pcm_train_03005	guy this game na sure l or if god bless us na d im not sure a w is possible	positive
pcm_train_03006	fine boys like dem dem no dey too dey look for girls nah girls dey rush them	positive
pcm_train_03007	site supervisor e no good o na the site money u give me that day wey i save i wam sharply withdraw like this make i no kill myself	negative
pcm_train_03008	this guy i was thinking about you today like e tey wey i see your tweet alfa	positive
pcm_train_03009	sometimes i forget that parts of s mural in my room is glow in the dark e dey sweet when i walk in and eyes dey look me best gift ️	positive
pcm_train_03010	get like each plastic own na u fit mix am toobuy ice block if u no get fridgeyou can buy up to bags of water at hu go even sell bags and pieces u fit buy bread join or snack supplierpeople go still chop there are many things you can do with ejikem o	positive
pcm_train_03011	make dem no go try pitch fela kuti with ronaldo as the best football player e go shock ronaldo self naija wey no dey gree for anything	negative
pcm_train_03012	i wish ah dey ondo road dey fight rich man say i dey threaten am pé him fit wound me	negative
pcm_train_03013	don drop bars on till i open my own account after the bars na bah remain to run my fresh account over to you boss	positive
pcm_train_03014	y una dey lie like dis i havent even sworn in decades	negative
pcm_train_03015	dj cuppy shares cute pic with her billionaire daughter femi otedola junk d e l e t e your a c c o u n t	negative
pcm_train_03016	what are u still waiting to start ordering your oppo phones and other great and available phones from us you no wan dey snap sweet pictures with great battery life and other great featuresdm im ur phone dealer now its my buttmy lips and skin me in these pictures	positive
pcm_train_03017	na from those kine girls na dna wahala dey come from later on for marriage	negative
pcm_train_03018	you sef don see am na mad sumtn	negative
pcm_train_03019	let people enjoy things but fashy o e get so many people wey no fit use computer o	negative
pcm_train_03020	your album na fire e don dey choke me for here but i no get voice to remix the songs	positive
pcm_train_03021	lol una matter dey make me laugh here that bro dey para for you	negative
pcm_train_03022	we dey find food chop oga we no fit save and or invest	negative
pcm_train_03023	just u call may rd just my colleague don go now na na hrs get me now i get back home looking like a zombie	negative
pcm_train_03024	me wey dey bear that name sef i look like agbero in real life the struggle us real sha	negative
pcm_train_03025	lol oh so no be say na the food actually no make sense na because of the people wey dey eat am i get but akpu na bottom tier good or bad all dey smell	negative
pcm_train_03026	sha this small money wey i dey talk took me almost months oo i still dey try recover from the expense sef	negative
pcm_train_03027	lol my boyfriend will na see thishe will na say im always looking for attentionhe will na say im grounded for a few weeks	negative
pcm_train_03028	fam you collect slap from peruzzi wey still dey upcoming e just dey like for keke to jam you instead of benz	negative
pcm_train_03029	i am so so depressed everything don tire me abeg which kind life be this sef at my old age i still dont know how to unhook a bra	negative
pcm_train_03030	some people wicked sha when dey won borrow money dem go behave like human being ok to return am now dey go turn animal turn u to enemy	negative
pcm_train_03031	this my neighbor don on hin generator again i no go fit sleep again	negative
pcm_train_03032	but donjazzy sir i am talking toyou this morning alone i don tweet at you like times don baba j na me o one of your biggest fan since when you dey shywey you dey always talk for dbanj ears wey he go come tell us na me o you self talk to me sir	negative
pcm_train_03033	lol them wan knack you apako you dey feel like them wan marry won tan e iwo na shana sí candle	negative
pcm_train_03034	im tired of yall if i talk you complain im nagging if im bleh you try to force me to talk unku pick your poison im good at both dont confuse me i have other people to be bleh to or talk too dont spoil my timetable do you want bleh or talk men	negative
pcm_train_03035	abeg make we no dey do like this i still dey young	negative
pcm_train_03036	arrrrrrrr im just seeing ds gb stuff im now feeling like im not in nigeria so yall got it for free where the hell was i na	negative
pcm_train_03037	be like wetin dem dey see for museum	negative
pcm_train_03038	come ayo dey baff ayo still dey baff‍️ mumu me said he go soon commot na my guy enter i don dey floor dey tear cry i was looking at laptop laptop was looking at me i sha got angry and barged into to the bathroom lo and behold	negative
pcm_train_03039	lmao im thereabout but e be like say fat and big belle don make me they look like gbemi	negative
pcm_train_03040	since am pesin dey on top henna design queue na by force	negative
pcm_train_03041	the of you are mad na me fuck up wey i dey praise una‍️ lets act pe i no tag una omo ale	negative
pcm_train_03042	i swear thats exactly what im worried about tbh questions questions that booklet na like pages na haha nobody can tension me o	negative
pcm_train_03043	everywhere just boring nothing to excite me its like ill leave this twitter for good sef una nor dey kuku patronize me again	negative
pcm_train_03044	its like something is doing you people player una never buy but una dey launch jersey we fit no smell top nxt season	negative
pcm_train_03045	we no dey get sense if the sack don full make we release am first and una go dey dull why i no go promise you billion wey i no get lol	negative
pcm_train_03046	omo na to enter gym chop iron like who dey starve next ooo summer borry no summer money yet	negative
pcm_train_03047	like if i knew the reason for the fight sef e for betterall i see is adults acting like kidsthrowing insults around like its the right thing to doit pains me too but what can we dowe can only read and waka pass	negative
pcm_train_03048	person no fit follow una play just ordinary gb una run go replace gifting with video pack as i no benefit from this now wetin una gain	negative
pcm_train_03049	nothing is there just big eyes e con be like say you wan beg ‍️	negative
pcm_train_03050	till today my best friend keeping making fun of me bout it say wetin i sabi i dey find extra sheet	negative
pcm_train_03051	lmao see our government official handle staking a case for nbc wetin dey do my country who we offend na press briefing	negative
pcm_train_03052	abeg i don tire to dey live by this damn rule i am not strong i dont want to be strong again i am tired someone else should be strong for me abeg	negative
pcm_train_03053	be like say this woman dey check out my teeth before dishing my meat every goddamn time i buy food na bone she dey gimme	negative
pcm_train_03054	where are you from im from kogi state ahh kogi people hope say you no dy do jazz but the girls sabi for bed sha yahaya bello dy finish una if you dont gedifok	negative
pcm_train_03055	day inside during welcome party omo boy turned back na one n one something oh men don already dey lap babes for dark places	negative
pcm_train_03056	wow what a hoe see as hin relax based on say na woman dey romance am	negative
pcm_train_03057	this tin dey pain me ehn a girl will come and post im new here show me the way or whatever the fuck it is then youll see all them miyan kuka gang like hayatu suleiman dauda saminu and co parading the tweet na una preeq dey itch una	negative
pcm_train_03058	lmao my secondary school no fit even do that sco whatever thing i doubt say we reach wey dey active for twitter d skul ratchet as hell zero boujee standard for that ends na only biola dara sochima and muyiwa dey this twitter as far as im concerned	negative
pcm_train_03059	doctor pele oooo quick recovery annnnnd this bracelet is sooooo dope na something like this dey fit me	negative
pcm_train_03060	f r i d a y thank god is friday weekend on d low b e l i e v e m o n e y e v e r e y lafia city stadium	negative
pcm_train_03061	im d friend who doesnt settle for mediocrity i push you to your full potential im the ginger man im the strong friend with the pep talk decisive advise d one everyone waits to give final suggestion im the honest leader cos i go tell you as e be in d sweetest way	negative
pcm_train_03062	e be like say we go get one wey go dey cook for us steady sef	negative
pcm_train_03063	lmao na why we dey shout say make people hustle so dem no go use cutleries emo cover ya face for group picture cutleries respect to mc oluomo oh	negative
pcm_train_03064	please im the hoe if you know where gold dey let me know make i go dig small see food chop abeg‍️	negative
pcm_train_03065	i was about to sleep till i heard anybody lord help me i don dey zanku dey gbese for mins now its am‍️	negative
pcm_train_03066	pikin wey no only fine but fresh im not crushing sha	negative
pcm_train_03067	me i like my naija police the wey dem be oowetin i dey find go america sef‍️	negative
pcm_train_03068	lmao me sef don dey attend wedding wey i directly sabi one half of the couple agba tin de	negative
pcm_train_03069	awwww good old days i don dey cook tey tey mehn	negative
pcm_train_03070	azin headache wey don dey worry me for days just vanish how to celebrate i no even know	negative
pcm_train_03071	im taking time to go on my annual leave this year i want to travel to enjoy my life somewhere im saving this money e never complete jesus pls safe me save me lord	negative
pcm_train_03072	e dey do me like say na me born	negative
pcm_train_03073	my surprisation oga yusuf wan rewrite a very recent history that is still oven fresh na you wan whitewash for us on this street same saraki of governor and senator thank goodness history has been restored as a stand alone subject in schools	negative
pcm_train_03074	bank wey i don upgrade to nm nm enter dem flag am and this customer care dey ask me whats that money for bro	negative
pcm_train_03075	angry mood well let me let it slide and sleep it off tired of reading peoples post and commenting rather they treat you as your a fan or a follower smh shey na you dey buy data for me ni abi na u dey give me pepper for soup	negative
pcm_train_03076	some women chew gum in public like sey na shit them dey chop so disgusting	negative
pcm_train_03077	bro abeg leave arsenal analysis na shebi you dey support manu abeg leave trash for lawma o	negative
pcm_train_03078	buahahahah but the town dey cheap and as for china since na big place we fit get chilling places at this stage we need cheap places	positive
pcm_train_03079	please please and please all these dance wey you dey give us be like examplease i no fit dey buy opa ęyin because i wan danceat least reason we the weak	negative
pcm_train_03080	lol this one na small na only the glass i go pick for ground because i go stone am for ground as e no high me i go pick am back for round	negative
pcm_train_03081	the account nor dey see the money but e dey hear am	negative
pcm_train_03082	batshuayi game dey wound my conscience walahii substitute wen no get steady voltage last pesin to enta field but na him still dey slow pass to catch ball like say him leg get belle this na match batman for fit help easily win but he choke as usual ‍️	negative
pcm_train_03083	f i n e p e o p l e thank you so much for bearing with us all through the struggles that	negative
pcm_train_03084	seen not sure what shes doing thoughe be like say she wan become snake	negative
pcm_train_03085	person wey dey cry dey see road nigeria is a big joke‍️	negative
pcm_train_03086	this manhole in my bathroom always gives me the creeps that someone will enter through it small kpram for night i don go check	negative
pcm_train_03087	omoo social media nowadays walai ko funny make d nigga with epilepsy just know where e dey spit go o make e no spit pass boundary woss	negative
pcm_train_03088	hearing any plane flying over and ill be hoping and praying its the one carrying my bag this people don turn me to mad person	negative
pcm_train_03089	onions be testing my grocery shopping skills because what in the is this st frame is ooó nd frame is worth because a bag is wahala for who no dey chop food without onions what is the cost of onions in your area saturday is shopoclock	negative
pcm_train_03090	dear could you please verify he has done in days what nigeria government is still struggling with since independence na beg i dey beg this man na national treasure	positive
pcm_train_03091	thank you lord for not letting me starve cos refuse to gimme food chop even as i beg her reach oo i don cook i don chop i don belleful las las god no shame me amen ‍️	positive
pcm_train_03092	wait e be like say years no go do fa man dey chop cake na me dey look picture	negative
pcm_train_03093	me sef shock	negative
pcm_train_03094	lmao shebi na una wan dey carry mata for head enjoy	negative
pcm_train_03095	amen good morning guys presenting to you some of the baddest sauces on our menu na lagos we dey o and na food we dey sell patronize us biko	positive
pcm_train_03096	i don wait so tey i don dey loose weight o come and support my ministry o street me with your orders i have panadol dm is open or send a whatsapp message to abuja nigeria	positive
pcm_train_03097	my pinned tweet ehn chaii e de burst my brains fam love is good o	positive
pcm_train_03098	angel see you you be like money deeone you wey your hair start from middle	negative
pcm_train_03099	una when dey give m followers how many una get	negative
pcm_train_03100	dont leave me oya bless your boy make he chop rice wey dem use derica cook	positive
pcm_train_03101	na when them dey try hide mad man he dey scream you take your two left hand type rubbish you no fear you no sabi if the girl dey stable you con dey type yen yen yen here monkey pawpaw oshi the songs dope btw	negative
pcm_train_03102	people don dey unlike pictures for ig and delete comments sha some even don unfollow am	negative
pcm_train_03103	na where my poor sev dey be that	negative
pcm_train_03104	broadband internet service is now in awkaunizik students una lectures na via zoom nowbetter merge in your lodge and buy e go help una ouna fit dey like dey use am	positive
pcm_train_03105	i really might not be the best but im such a baby girl porthacourt peeps always asking wheres landlord na so una take miss landlord yesterday ooo even called me landlady	positive
pcm_train_03106	na drip sunday african version na our list of the hottest african women wey dey support in order if you no make our list no vex we no fit contain everybody	positive
pcm_train_03107	alhamdulilah not by my might nor my power buh wait how many is dat my body self that i dey mention might n power ‍️ so i say alhamdulilah once again what about you dear brothers and sisters or una get one power wet m u no tell me about no	positive
pcm_train_03108	this spoil d only in my akkant last month e b like say my life wan end as i see the message last card wey i don dey norture	negative
pcm_train_03109	we have our different love boxes plans to suit you budget mini box maxi box of contents like doughnuts cakeschocolates and many more never forget sey love dey give and e no dey give finish	positive
pcm_train_03110	omo sis una dey wild dey try calm down	negative
pcm_train_03111	see as pepper fine guys nah dis kain pepper school for obodo abroad you wan know how your pepper and agric products fit get abroad tushness despite being local check	positive
pcm_train_03112	today na april fool notin to de lie abeg nobody should joke with something i get if not dem gho con bundle u for house i look u laugh	positive
pcm_train_03113	me sef try small ‍	positive
pcm_train_03114	no competition dear anyhow u wan run ur own run am dem no dey carry last or first just have a peaceful home	positive
pcm_train_03115	na bcos i like you that why i fit answer you when im eating bread you gat a special place	positive
pcm_train_03116	because say i no get money i tell you make we busterines you no gree comot pant	negative
pcm_train_03117	he wasnt live oga na de ow brixton performance u de talk say na live	negative
pcm_train_03118	oga we go chop ur fada ooo u just dey mek people relationship dey shake god even save she no dey watch ur movie and na dark skin guys she like	negative
pcm_train_03119	can you just shut up abeg like shat up sheybi na your pikin them burn you for her mouth dey yarn okoto like this	negative
pcm_train_03120	lmafooo na me wey no fit marry ni	negative
pcm_train_03121	omo e b like say dem dey increase their salaries anytime dem take the light then at the end of the month they will now bring billdem nor get conscience	negative
pcm_train_03122	e fit be cow i carry takeaway when they give me price i was like huh what i chop	negative
pcm_train_03123	na person wey get money go put money for account na happy sunday jàre time for online service	positive
pcm_train_03124	shurrup abeg rt no be say i fine sef	negative
pcm_train_03125	na una type de run like never before	positive
pcm_train_03126	we wey we dey nija still dey enjoy if you see the way nija babes bill nija guys in abroad ehn baba you go run my daddy this my house that	negative
pcm_train_03127	hanty kenny welcome to adulthood na so we dey roll some months sef na to enter gbese settle some obligations sometimes one can wish the hands of the clock is reversible but despite everything we still stan u shall overcome sis	positive
pcm_train_03128	if not that its new year and its too early i for just dey cry im not strong thats why i dont pass my boundary im soft i just act like one strong woman	negative
pcm_train_03129	the rate at which i listen to godly song ehnif to say song dey skip nie for don dey skip on my phone like im addicted to that song	positive
pcm_train_03130	i always find this funny cos i dont get it should i stay around you and put my mental health on the line watching you flaunt my tl person say e nor go buy wetin you dey sell you nor go find another customer	negative
pcm_train_03131	faraday odensin the individuals and companies placing the ads na from okija shrine dem dey worship abi or na amadioha dem dey worship	negative
pcm_train_03132	we just wan say we appreciate all of una and to our fanmily members we say happy workers day to all of us wetin we dey take put food for our table no go fall comot from our hands happy new month and happy workers day	positive
pcm_train_03133	ndidi na rugedy babai like him always a nuisance to the opposition i wish kelechi can get a goal in this game e don try	positive
pcm_train_03134	the real name for should be na d real life we dey see be this same people wey evict you go still cry when you dey leave them go still dey form celebration when them see picture for wall chop with each other but them no like themselves sad o lol	negative
pcm_train_03135	oya ohhh make every business owner go watch this video times ooo e go do you well because plenty of us don dey do business the wrong way shey na true talk be that even if you attended the free day esme money bootcamp with try to watch again	positive
pcm_train_03136	if your papa na police officer you suppose to they go deliverance time to time because normally e no suppose better for all of una for una family	negative
