ID	tweet	label
pcm_train_01487	whys supersport doing us this kinda strong thing naaa na bad chelsea badno be say we be alaba nollywood movie wey don crack finish naa	negative
pcm_train_01488	e be like dem dey boil nigeria for heavenheat for delta	negative
pcm_train_01489	go market go buy cow skin na cow skin no fit sweet like ponmo sef imagine person say peppered cow skin	negative
pcm_train_01490	my eating habit is messed up na until my body dey shake like chicken wey get flu before i gree chop ‍️	negative
pcm_train_01491	the heat no be here oo you go baff say make you no clean body to feel fresh small seconds na sweat wey no dey gree dry	negative
pcm_train_01492	but jaru fuck up sha how can you be selling regina mixpresident wife mix all the mixes to catch rich men to spend on you but you no fit catch even if na after rich man nne e fok u ezigbo up biko	negative
pcm_train_01493	oh wow we sef just dey finish and mandem still wan go beer barn i no fit abeg	negative
pcm_train_01494	shey u people are seeing daddy enny now which kain love be this i say goodmorning e no reply i notified him e like my comment he still no reply	negative
pcm_train_01495	una no even allow the guy wear better cloth e no good oooooo please release him nothing come out abeg just show say you big pass	negative
pcm_train_01496	no dey use this thing joke na im sad here guy	negative
pcm_train_01497	like i dont get it with those unfortunate lotsmake everybody de dia de o	negative
pcm_train_01498	god forbid i do nonsense pps again na the suffer wey i suffer be this wey person go dey tell me is it not just lines	negative
pcm_train_01499	so i slept off and many things happened when i was saying stop shipping some were calling me bitter cruise on this show una no dey hear or hv a fav anywhere his or her belle face u follow it wil end in tears david is the ultimate scam for now next	negative
pcm_train_01500	ole go the act like say ehn know wetin e dey do	negative
pcm_train_01501	na so i tell egungun liverpool to be careful now e don happen them con dey waka alone now	negative
pcm_train_01502	i swear ladycare that year do me strong thing for this life shaade shifting de dragging were i have to be fighting with my pant publicy all in a bid to be at least comfortable while losing blood ewww god e be tings for this period hassle wey guys wan troll us on top️	negative
pcm_train_01503	upon all this likes na only subscribe tragic‍️ try and do am na i wont reach p secs to do and finish make una help me reach k subscribers na	negative
pcm_train_01504	baba don try smoke corruption out of nigeria like weed and now e don corrode him brain	negative
pcm_train_01505	wetin you expect e get any better thing wey dey for sahara desert	negative
pcm_train_01506	e y e t e n t i o n never have i seen a blue eye shadow look soooooo gorgeous all thanks to lacici x available kano st yanga	negative
pcm_train_01507	de beautiful smile dat i never c like dat fine face	negative
pcm_train_01508	pls tag dat personwho knows person wey sabi personmake he help person before person go tire link in my bio song music group crystal dynasty	negative
pcm_train_01509	lol me im still think of how my masters reading will go when i start and your results already giving you phd vibes hain oluwa wetin dey sup na when youre smart youre smart biko	negative
pcm_train_01510	e go better make we dey guide dem dey go	negative
pcm_train_01511	since you na no wan buy car again i don dey sell trucks now come let me take your orders	negative
pcm_train_01512	im telling you i just dey chop thank you upandan	negative
pcm_train_01513	me when you tell me that im handsome stop whining me na tell me im pretty ill know you mean it	negative
pcm_train_01514	i gat to put my acts in check and my shits together to keep my life daily fine tuned for god dis crazy heat reminded me dat i cant go to hell when its merely shukuli compared to de real thing if i eventually fuck up at the end of de day not pleasing my maker	negative
pcm_train_01515	if the meter is good but let the man chop small abeg where person dey na their them dey chop	positive
pcm_train_01516	lol i cant be in that kinda chat ordinary private chat sef i sabi how many bcs and vns i dey receive from my parents every week	positive
pcm_train_01517	u win but abeg do me a lil favor drop ur phone googleat home enter streets jam people wey u knw wey sabi ball or ask any professional close to u abt this our small argument	positive
pcm_train_01518	see your mouth like ask him una no sabi wetin una want gan gan confused beautiful creatures	positive
pcm_train_01519	na wetin dey vex me be that after saying shes not looking for love shes just going to go with the flow and not overthink now now her brain has burst with thoughts	positive
pcm_train_01520	e be like say these elites no know say erica don also lose all the money wey she win	positive
pcm_train_01521	lol i dont wanna believe this i think na because of babes wey i dey post for status make her insecure	positive
pcm_train_01522	hahahha rem dose days dat i fit kill for dis ynx gashi nan a banxa	positive
pcm_train_01523	dem scatter every where from the beginning and still dey scatter things wicked generation how can a country like ours still be struggling with electricity upon all the professors and self acclaimed visionary well positioned leaders dem even get gen for house and office‍️	positive
pcm_train_01524	no be everybody you go gree for now who knows maybe the person wey you no go gree for na hin come dey shoot for tl omo e no go sweet ooo	positive
pcm_train_01525	mosafejo sef don dey court faith go register waec for miracle center she carry success godem gather fail dey don scam soji for computer village‍️ dem talk say emeka no make ham even efcc catch oriyomi‍️	positive
pcm_train_01526	just broke my heart i checked my notifications and saw a new video just when i settled down to enjoy it boom e don end o wrong nau na this same reason we sue simi for duduke that year	positive
pcm_train_01527	if dis is true omoooooo i go just tell dem say i go seat for d exam next year cos how person wan take dub like dis e be tins oooo	positive
pcm_train_01528	lwkm those boys at tinubu square e no go better for una parked my car paid and entered market i came back to notice lastma don tow my car	positive
pcm_train_01529	gaskia na true ooo why you go like my sister nah when i know wetin you dey do other peoples sister	positive
pcm_train_01530	na like this auto correct go kee somebody one day just wanted to hail an old class mate that has been married for a couple of years without any issue nk baby na so my phone sent no baby how i wan take begin dey explain myself now	positive
pcm_train_01531	he was asked are you a hard guy next he did this ️and i told him ooooo no dey do like that alaye no dey do like that now dem don turn him sharpness to mugun song title ballerz	positive
pcm_train_01532	to get over her i havent seen my baby in that kind of situation my boy went offline and wasnt picking his calls wow na so e dey pain he said his chest is paining him the girl did him strong thing to the extent that i had to ban her name from this house that time	positive
pcm_train_01533	ozo isnt sharp after all this guy is too dense abeg why i go dey stan this kind person sef arghhhhhhhh	positive
pcm_train_01534	e be like dem don suspend twitter for instagram o	positive
pcm_train_01535	no vex abeg who is with ozos calabash help us break it abeg e don too much	positive
pcm_train_01536	now i don dey stuck cant withdraw cash cashless withdrawal no dey work thunder will faya all of you that recommended their shitty service	positive
pcm_train_01537	my ex that actually told me one time that if i leave him and he blows ill regret it hes still struggling im not even there yet and im not mocking hi but abeg this mentality na mad one i almost cried that shey ill not regret true true like this	positive
pcm_train_01538	you brilliant na me wey be say na me dey coordinates panpa for my set our room na neco office cc	positive
pcm_train_01539	if to say grinder no grind rubbish wit the stewthe soup for sweet well well aw i wish say e for fit taste like beforei bin miss those great tastes persin dey digest den emiking oluwerimagboojo son	positive
pcm_train_01540	lmaooooo na popsie dey settle quarrel that time na so policeman hit boda abayo barber during monthly environmental sanitation stuff a fi laiiiiiiiii boda abayo load am back street scatter again tear gas everywhere when they reinforced	positive
pcm_train_01541	e be like the zobo making don go school na y nothing person no go see for naija	positive
pcm_train_01542	be like say apple dey med fireboy album wey i download full for nigth this morning them don delete am	positive
pcm_train_01543	which kind vee be this abeg just dey so uninterested as dem ride her man	positive
pcm_train_01544	abun ya ban mamaki wllh an ce abincin wani gubar wani people we dey avoid like plague na dem this big man dey gravitate towards dey chop	positive
pcm_train_01545	dem say $$ weak but currently at a + rate to the naira what if e wan strong what kind of country is thiisssss	positive
pcm_train_01546	ogs had better started working i no fit dey shalaye wen people dey banter	positive
pcm_train_01547	this game tho the kind thanksgiving wey i for collect from my guys wey follow play sha business don spoil	positive
pcm_train_01548	shey na you say make i go last gate go chop abi wetin be that placeno try am again everywhere stuffy and smelly hot afternoon people din smoke cigarette full everywhere i left	positive
pcm_train_01549	semo no involve for better conversation na why dem dey always drag am	positive
pcm_train_01550	na dem like fgs leave me na make them no see say you post status like this problem ive blocked them from seeing my status	positive
pcm_train_01551	omo she don dey swear for una papa o i hope i dont get blocked by association like this	positive
pcm_train_01552	na so e be o some of us no get this kain strength na to give up	positive
pcm_train_01553	e don red ooo neo don vex he say he no do again ooh vee how far make u melo ooh na warri boy u dey run matter with ooh make you calm down try understand ur man na pikin wey stretch hand na e mama dey carry ooh	positive
pcm_train_01554	leave them jare idiot people people wey win am no be them dey their front na to chase clout	positive
pcm_train_01555	the kind goat meat pepper soup wey i dey crave ehn and time don go	positive
pcm_train_01556	when i listen to dis video i felt like crying what has erica done to dis woman because erica is an ulcers patient she adds alot of pepper in her food so that she wouldnt eat y dis hate nah	positive
pcm_train_01557	likeeeee my papa carry am for head like say na him fail oh any small thing dem don table my matter	positive
pcm_train_01558	for where banks that will still send debit alerts all alert na alerts it depends on wetin di alert carry come it fit be joy or high bp	positive
pcm_train_01559	you lots should say it as it is na tosin was sexually harassingassaulting young girls simple which one is tosin was sexually assaulting young feminists una don dey do like say this feminism thing na organization wey anybody fit just join bloody hell	positive
pcm_train_01560	i swear well e be like say oppo don show all of them say levels dey na why dem come with stronger agenda and hashtags na eyeopener na now dem remember say life dey after bbn or without winning	positive
pcm_train_01561	mackson wan invite boys come drink gordons for him house i no dey interested bros i dey okay with my lacasera for house	positive
pcm_train_01562	if biggie really evicts erica today lol i will just switch off my phone and escape twitter because i don dey prove points since like say na debate	positive
pcm_train_01563	poverty na bastard lmao dey there dey call erica a hoe waya of wayas is already planning wedding	positive
pcm_train_01564	d tin dat is paining me is dat d guy doesnt like her like dat sef	positive
pcm_train_01565	abeg make una hold una light for there to come out and go back home in that place is a nightmare when person won reach house dont even say ferry that thing is a death trap	positive
pcm_train_01566	lmfaooooo fine face wey be sey bola wey dey sell bread for yaba get	positive
pcm_train_01567	e be like the yansh wan commot for the body	positive
pcm_train_01568	this todays eviction show was very crazyyy why my guy brighto go commot jus like dat una no try at all	positive
pcm_train_01569	damn all this tech revelation is scary na why i no see anybody build with be this men dey red even my friends dey ask for money	positive
pcm_train_01570	but stop na people will think its true na ive not met you guyyyy you dey edo i dey lagos	positive
pcm_train_01571	come be like say na only women come my show guys what is you peoples wàhálà na una leave phone for house	positive
pcm_train_01572	the same babe wey you you wan die on top her matter for this lagos nah him some boys dey use do point and kill for sex party	positive
pcm_train_01573	na only one picture i see wey soye dey jump and he said it like it was yall‍️ i hold una for mind oh i nor go lie	positive
pcm_train_01574	thats one thing with beautiful people they think beauty is everything so erica we the ugly boys association uba no dey kiss fine girls im disappointed oo person wey i dey use make mouth don cast me laycon	positive
pcm_train_01575	somebody help i wanna renew my sub and i mistakenly send airtime to another number with just one number with imidiate effect i call the number i swear this nigga say bros i de look for hike to sub i no fit talk again na so just go	positive
pcm_train_01576	una wey dey watch lucifer dey go hell fire how lucifer go good and angel micheal go bad small time god go bad hell fire with brimstone is waiting for yall that watch lucifer	positive
pcm_train_01577	lmao as i dey see the beard e dey pain me	positive
pcm_train_01578	fried chicken please e get this fried chicken me ion know whether dem dry am finish before dem fry am because e nearly choke me today small bite mouth don full one cant find space to breath n you no fit use hand cause na public place	positive
pcm_train_01579	good morning sir kindly tell erica to leave laycon alone my guy go dey eim own she go waka go meet am then begin do pda for eim front abeg tell the girl to leave my guy laycon don fat small abeg icons help me tag uncle	positive
pcm_train_01580	i swear when you know its for rollover youd be extra careful and na the kaain thing wey dey burst slip	positive
pcm_train_01581	i dun tell you this thing back then say you get very fine legs you looked at me like i bin dey yan okoto meow meow skrraaa well im glad youve realized not just legs sef the whole package is on point	positive
pcm_train_01582	boss i just came online and saw you don bless plenty people god bless you plenty too abeg make e reach my side too i get rubies too	positive
pcm_train_01583	b e s t b r o w n i e s ever ⁣ ⁣ im not bragging im just saying the fact they are sooo good and yummy ⁣ ⁣ so moist chocolatey chewy fudgy and decadent ⁣ ⁣	positive
pcm_train_01584	father i got d song wen i was praying i didnt know wht exactly it meant not until something happened dat period nd i knew dat no mater d situation going on in our lifes god knows best and he never lie go on google search for the father by liberty adechrista n download	positive
pcm_train_01585	eye meji okin je asa any other b you see you don already knw say na counterfeit we were still flexing together in lagos when he came arnd in feb pre covid e don tey fam we can only thank god his blessings on us we ve come a long	positive
pcm_train_01586	omo this love don dey enter my body again i think say e no dey last ni i was wrong	positive
pcm_train_01587	just listened to the freestyle i did with in will release them to test the waters add recent freestyles i hope ya all support apple audiomack spotify and any platform wey god fit put me on insha allah e go fly	positive
pcm_train_01588	please what does he not know ah me sef wey study botany no know this one up until now thank god im stanning him	positive
pcm_train_01589	see the fresh chief people see and say we look alike why una go dey whyne me like this na happy birthday best roommate in the whole world thank you for being my brother	positive
pcm_train_01590	good morning big bro abeg na vn u go de use reply my whats app now	positive
pcm_train_01591	dele momodu and terry waya dey plan wedding kidd dey catch cruise now ship don strong erica	positive
pcm_train_01592	don baba j please console me ooo na cutting one ooooo i have too boss and im active	positive
pcm_train_01593	show us the way na tope na please na i am begging you	positive
pcm_train_01594	you people na dont let me start begging for money na i can work i want to work i am ready to work please come and buy jollof rice for lunch tomorrow place your order now e jor biko mbok da allah kindly retweet please my customers are on your tl	positive
pcm_train_01595	as long as them write shea butter for the body im most likely to believe e good die i suppose dm you since self i wan do my baby hair	positive
pcm_train_01596	papa god a day reach out i wan day tlk to you oh na small prayer no vex nobi like say i want stunt all my haters but i just want simply flex i jst want to chop life make owu no catch me me for offside papa im dwn on my kneels make your pikin get this mola	positive
pcm_train_01597	im trying to laugh it off o na me dey find funny things sef	positive
pcm_train_01598	i get black long sleeve shirt and black shoe even rail way dey for town wey train no dey pas infact we fit sleep on top remain money to buy that tight blue trouser and that sexy gown with person daughter wey wear high heels inside so help me god	positive
pcm_train_01599	omo that match wey i bin don equalise only for u to score the th i wan crase i just happy say u win that round cuz if not we fit still dey play go	positive
pcm_train_01600	a client gave me k to make a birthday cake for her daughter with icing sugar i told her ma this money wont be enough to do what you want my mum was like do it for her na na we we in my mind shey baby we we i dey use fo market i dont like doing business with my mums crew	negative
pcm_train_01601	covid has done more damage dan good to me dis year d fact dat i wont be able to open my store dis year is so heart breaking whenever i think about it i just feel like throwing myself on d floor while wailing my eyes out its so unfair	negative
pcm_train_01602	we finish diplomathem no allow us continue wetin we start some people sef won serve shey mesef go fit serve like this abi dem no know say age dy count	negative
pcm_train_01603	if una give nia federal housing lugbe light una go die or una go stop to dey bear the name aedc sigh	negative
pcm_train_01604	my generator has been burning my sis charger probably cause it too high this night na jeje i dey wey my neighbor won charge now e don burn how i go tell her	negative
pcm_train_01605	e be like dem go zoo dey snap picture with pagori abi na granpagori na gori i talk oh if you add lla na oyo state be your case	negative
pcm_train_01606	omo you dey yankee still dey say make i dey pay you monthly salaryagain i have useless friends	negative
pcm_train_01607	guy i no even fit watch the match cause na we dey hold ball na them dey score‍️so na europa like this	negative
pcm_train_01608	why ole dey fuck up like this no dey shalaye na u no need am	negative
pcm_train_01609	the fan wants to be held nah but if this girl get boyfriend the guy go don drink tiri keg of water cos em eye go dey reeeeeed em body go dey shaaaake	negative
pcm_train_01610	those ones been still dey there them hang them like sculptures omo that zoo don caste oo zoo wey been be major attraction for azuabie town we go wear eye glass like spider man pay ₦ for gate enter go get joy but now everything don burst	negative
pcm_train_01611	hope someone is checking om that dancers husband make e no vex follow them because na exactly wetin i go dey reason	negative
pcm_train_01612	my friend vex for bank para say e wan close hin account the branch manager sef come down beg am he still no calm down dem check hin balance dem give am form	negative
pcm_train_01613	this twitter assault on + guys shey we no go just dey this + like this na dem be na no	negative
pcm_train_01614	bros na true oh like say we start during lock down we for don pass morocco na just to buy many gala dey leg am	negative
pcm_train_01615	im so happy a vile andrepugnant woman whatt i watched those videos praying someone would walk up to her and lay her flat out we tweeting about this cos dis na the wan way we see o this much hate andgalling racism occur almost every other day mehn i was livid	negative
pcm_train_01616	e be like say fuel don dey finish for united motor	negative
pcm_train_01617	see as i be like sey i dey roll for ground since yesterday person go come dey tell me sey make i show love na sey i stingy ogun kee love i never sleep since yesterday	negative
pcm_train_01618	just a night sleeping without pillows my neck is stiff i cant even turn it e be like say e don break you people that sleep and wake up comfortably without pillows how do you do it	negative
pcm_train_01619	quick setting na fraud lol we dey find goal baba leave snail for field when attacker full bench my barcelona don suffer	negative
pcm_train_01620	get out joor which dm are you talking about abi d wey u dont like dey reply people abeg no make me vex ryt now	negative
pcm_train_01621	i asked about a friend whereabouts she said i prefer to keep it to myself as per e no concern me e pain me cos na true e no konsine me truly	negative
pcm_train_01622	its hour now beans no wan gree soft instead na burn e kuku dey burn abeg who i offend please forgive me allow my beans to done na i need to chop before i go work	negative
pcm_train_01623	overnice haff killed meaunty don go use money for goods do birthdaycome dey tell me say nothing wey i fit do about it the way my head is boiling and people asking me to go to her housei go rough handle her which i will never do women can pretend o like fucking pretend	negative
pcm_train_01624	this how it used to start o from tagging me to single people thread on twitter next thing na invitation to singles conference what next flyer inviting me to shilohsee im not single pls im dating in my head nd shes the most beautiful girl av ever seen thank u	negative
pcm_train_01625	so am some where watching my match ars vs liverpool an arsenal fan is busy watching old epl match where arsenal won man city he goes on to say make i use this one console my self arsenal don spoil see wetin them dey play na	negative
pcm_train_01626	oga mi i understand jawe e reach to pain person no need to wait till dem do am to person wey close to am to take action its becoming a joke to them all till we start to hold them all accountable for such stupendous false accusations manyandmore of such we dey see now	negative
pcm_train_01627	man you ask me for money i say wait till next week money wey i get now i dey use am you con talk say we be enemies omo im not giving again you people take people for granted and its annoying asf i dey lock up	negative
pcm_train_01628	stop this nahhh i dey chop hot dog for sharwama i cook spaghetti hot dog is inside indomie hot dog is inside even my nigerian jellof hot dog dey pls nahhh hot is like a spice to all my food	negative
pcm_train_01629	my phone camera just broke my heart i snap picture n my oga called me mr tycoon u looking good this man does not know na camera iphone dey help my life top league for this girls heart so this man no go wan help me again oh	negative
pcm_train_01630	e be like say na the whole abuja dem carry light o kva transformer is down at the moment me thinks	negative
pcm_train_01631	i dey site they hustle you dey bill me untop k wey manager never pay me	negative
pcm_train_01632	that beans and garri na story for another day mhn see as i dey chop that thing when i broke like say na kfc las las we no die sha	negative
pcm_train_01633	jumped my first fence in isl just to attend their socials funny thing is that i wasnt even a student na my mumu cousin drag me go and as i see boys dey use fence audition for mission impossible me sef join	negative
pcm_train_01634	devil after seeing some humans wickedness devil dey learn where this woman dey let her rot in jail all i care im livid rn	negative
pcm_train_01635	should i even start talking about my computer village funny experiences lol in naso dem put me for middle carry me go corner obtain my n zain airtime and small change wey dey my pocket this was the first serious negotiation i made in my life i was barely	negative
pcm_train_01636	just bcos i told u ur car has comprehensive insurance doesnt mean u shud go and jam police officer nau abi wch kain wahala be dis sef na insurance man i be i no be segalink	negative
pcm_train_01637	the work my mama gimme today you go think say she don mean me like say she set trap for me as i no dey come house work continues tomorrow i don tire abeg	negative
pcm_train_01638	please no date who no date you o e get why some girls beside me dey table one guy matter say the guy dey date am and she know no ‍️ e dey pain me as them dey reason the guy anyhow my gender don fuck up again ‍️	negative
pcm_train_01639	e pain die omooo e be like sey na to dey support my arsenal in silence oh this banter don too much	negative
pcm_train_01640	so like play like play one guy don loose hin girlfriend cos site no dey pay well may day may day a guy is down i repeat a guy is down	negative
pcm_train_01641	i really want to whine him but e fit mute me again make i no dey see his status	negative
pcm_train_01642	my dear oh i don ask taya shey nobi disease madam sef don dey seize n hide my foods for night sometimes i go buy cookies hide am for kitchen late night sneak to the kitchen to chop am	negative
