ID	tweet	label
pcm_train_00001	akwaugo i da greet oooo i da fell una paroo abeg make u help me with iwa by phyno make i use joylifucate dia cool afternoon	positive
pcm_train_00002	my big appreciation to everyone thay participated in this poll it means alot to me and fragrance scentuary god bless you ladies shebi una don see am ‍️ west feminine fragrances for unku them abeg dont be dragging male perfumes with men	positive
pcm_train_00003	just if blesses you abeg no forget the money wey i beg for whatsapp make i fit see tfare go work tomorrow	positive
pcm_train_00004	na my best number no mean say i go be for age every year na im this year but my demeanor speaks ill be next year ️	positive
pcm_train_00005	it will be a travesty of justice to include dasuki and not marry him wdiezani on the same stake let di same bullets kee di of dem together	negative
pcm_train_00006	e dey boring die dm me lets talk na	negative
pcm_train_00007	i don vex too ocos d one i watch earlier nr add d last part d show b don end for me	negative
pcm_train_00008	i thought you are supposed to be lecturing us on healthy lifestyle only for you to be asking where is my king e dey kingdom for gwaragwara nation add value im ready for fight come o or say thank you	negative
pcm_train_00009	joke of a government na thunder way de do press up de wait una	negative
pcm_train_00011	o boy e don tey wey i hear brymo voice o eko is classic	positive
pcm_train_00012	please ooo i am not hurt i am just reacting to a tweet i saw about soft men even saw people who have dished pain to the softest men i know waggling their tail there na wetin vex me i am good my women dey try ️	positive
pcm_train_00013	them don dey sell black market o and baby girl like me cant queue epp us na big daddy	positive
pcm_train_00014	baba na who dem give dey give thanks i don drop details tire make i smile like others na	positive
pcm_train_00015	yeah ‍️the guy wants to trend dat was why e join nysc e cant trend with good music again	negative
pcm_train_00016	see i wont lie to you all the richest people on the tl are the most lowkey na us wey get k for account dey always snap picture every time dey make nonsense noise on top tl	negative
pcm_train_00017	omo na wetin be all this one na gig don finish again wey na monday afternoon i suball this isps tho	negative
pcm_train_00018	it will not better for d handlers if this fpl thing oo fraser has always been in my team since the start of the season yesterday dem put caution to his name that he might not play na so i sell am now guy don score goals for st half	negative
pcm_train_00019	this life is so funny sef you will work hard and buy cloths and shoes and rain will start dictating when to wear them for you because you see rain to wear white na war to wear suede na wahala shoe wey i take my money buy	negative
pcm_train_00020	lmaoo i no get strength to dey think wetin valverde go play abeg	negative
pcm_train_00021	dis is unfair of urcompany goingtowks nw ive bin complaining abt d subscriptioni did wch did nt reflect on mydecoder nd im givin u an ultimatum else u willbsurprised my next reactnim makin dis publicly nw ive chatted u privately showing evidence of payment	negative
pcm_train_00022	lil wayne don vex me im actually not excited again	negative
pcm_train_00023	im not just broke my account red don dim like mad ‍️ e thick pass dirty blood	negative
pcm_train_00024	dis is unfair of ur company going to wks nw ive bin complaining abt d subscriptioni did wch did nt reflect on mydecoder nd im givin u an ultimatumelse u will surprise my next reactnim makin dis publicly nw ive chatted u privately showing evidence of payment	negative
pcm_train_00025	k stake to play psg win and over na im i wan do naso i go add one nijemen for nairaland	negative
pcm_train_00026	e be like u sef dey mad	negative
pcm_train_00027	jesus the last part got me laughing wetin concern me shebi na person wey na know im worth go dey praise politicians for street many are farmers traders even some jobless i wonder why they even introduced politics to africa were civilized tho	negative
pcm_train_00028	this celeokota traffic na one chance o belle dey turn me	negative
pcm_train_00029	this is how we roll on the street if refree do anyhow we bounce am only say me wey dem change sef na error i no what my eyes saw sha follow	negative
pcm_train_00030	e dey scare me sef kilode	negative
pcm_train_00031	remind me never to listen to you again wetin be this abeg im listening to it and my roommates are laughing	negative
pcm_train_00032	sure parole with dem boys dey mainland like this but no be me dem go use trend tomorrow these lagos police officers are unruly	negative
pcm_train_00033	daddy mi o if a day is possible sef we go come dey chop chips and gala like if we walk too far from departure we go miss flight	negative
pcm_train_00034	congrats to your folks youre the ugly one e go make sense if your kids sef dey sprinkled somewhere in the picture uncle wale	negative
pcm_train_00035	taxify and uber needs to sensitize their drivers on the need to smell good at all times if they are not interested in their own hygiene they should at least smell good for their consumers e remain small motor go show una fit dey do anyhow then but until then pirri me	negative
pcm_train_00036	| w e e k e n d j o y | when you over deliver thank you for making the process stressless had my heart in my mouth until	negative
pcm_train_00037	u n e d i t e d s e r i e s owambe saturday bookings ️ we also love our walkin clients muse ibukun	negative
pcm_train_00038	today marks one small milestone in the beautiful journey of lifei believe dat im the equivalent to a fine wine or a delicious cheesed older the better im trilled to be another year today i create within me a vacuum that no one can and will ever fill except god	negative
pcm_train_00039	im a big lover of music but i cant stop laughing anytime i remember that song where he said the only competition i get na dangote my broke ass was kuku singing it with him too na when e reach that part i dey shout pass sef we will sha be alright	negative
pcm_train_00040	show me love i use god beg you i no want money abeg just one song abeg i dey beg	negative
pcm_train_00041	na jamzi dey drop lines like this oboi jamzi sef mad that year oh	negative
pcm_train_00042	kano pple or if u dey kano around dis tym you need to put dis in ur letter its gonna be blazing amazing will be around cc kaduna state	negative
pcm_train_00043	family dey call ooif no be billing na something dey sup oo real st come and drop your wetin my eyes don see vibe on this guy track abeg worldbest na skylevel only ️	negative
pcm_train_00044	ur testimony makes me dis god he z a true god he works n ways man cannot understandu were n pain bt just dat song nara brought abt ur healing lyk u said fr days nw u hve not bn n pain who has done dat no bt jesus all glory return to him alone	negative
pcm_train_00045	fine boiz like es na dem dey rash es congratulations	negative
pcm_train_00046	e nor come bad now	positive
pcm_train_00047	and na so god go take bless you pass wetin you dey expect	positive
pcm_train_00048	sweater god e don dey be like my supervisor disturbing me for project	negative
pcm_train_00049	e no get who no get him own wahalaeverybody just de smile de waka jeje so if person no fit helep you todaynwannem nwoke nwanyi understand and move on if you continue to worry am and him block you patapatae no mean say him wicked o e only mean say you no get sense	negative
pcm_train_00050	fat abi thick people please no vex buh how do you people do it like breath stay comfortable with tight clothes clothe i made in december today i no fit use am enter bike e dey choke	negative
pcm_train_00051	na them dey support nigerian idol and na crazy people full auditions	negative
pcm_train_00052	lol but the guy is an anonymous na we can say hes not begging but venting him don go broke because of woman baba say him dey sapa	negative
pcm_train_00053	e be like say oga chairman true colour don dey show cos dis him determination on top dis election mata ehn don dey pass be careful o shey politics na do or die affair ni fresh episode of dey show at pm on top dstv and uhf terrestrial	negative
pcm_train_00054	wahala be like ebube if you still spell am backwards na still ebube today is easter and all i see is violence everywhere that ejikem guy has never for once trend for good reason na who do you this thing now	negative
pcm_train_00055	chews loudly because i cant stand snoring its one of my greatest fear in marriage marry wife finish she con dey snore omo na to return the wife	negative
pcm_train_00056	if by tomorrow i cannot make transactions with my account ill be done with yall and thats on period i know the money wey dey there na small thing butmake e work well napeople cannot even help my lifewhats this one na	negative
pcm_train_00057	the kind sweat wey i don sweat today ehnnn even if i dey drink furosemide the water wey go comot no go reach this	negative
pcm_train_00058	like where i wan dey see k monthly where i dey work	negative
pcm_train_00059	yess ooo be like e don cancel trip sef sigh	negative
pcm_train_00060	person wey i wan shoot shot to don egbonzone me again ooo	negative
pcm_train_00061	wetin ndi awka do una for this app bikonu na crime say we love enjoyment ‍	negative
pcm_train_00062	i no fit marry man wey dey fight for nxt sha na everyday i go dey cry	negative
pcm_train_00063	why hotel towel is so big like this see now i wan comot and my bag zip don spoil abi na my vl ppls	negative
pcm_train_00064	you see those ones wey dey change paper to money i no dey believe say dem dey exist until d day dem run me pure street since last year sept i still dey think about my k till today na k these bastards use to cover d perfectly cut cartons wey be like real money ot of life	negative
pcm_train_00065	better dey careful oo be like sey twitter shadow ban our king cos of hin tweet for april fool o mk dem no get you too o	negative
pcm_train_00066	its so pathetic why dont we really think abt our clients wen we are doing business here in nigeria becos of our greedy n love money nah we go still come dey say govts bad bad abeg no mind dem for me nah pay on delivery so if d product is bad its only tf i loss	negative
pcm_train_00067	na the witchcraft part omo e just dawn on me say true dem don turn black witches o	negative
pcm_train_00068	na all of us dey this table my actual reason sha is because the thing dey lazy person to wash like why do pots have to be so stubborn	negative
pcm_train_00069	i have washed and comot my hands from husband and wife matter oo no be my head dem go use cut coconut she don dy post and praising her husband again ahhh married women are sorcerers	negative
pcm_train_00070	as dey luciano now sheybi i for go catch money but i don chop overfeeding my dress no go fine well well	negative
pcm_train_00071	this ramadan im reporting plenty people to god una don too do me strong thing	negative
pcm_train_00072	you see why sticking to what youre familiar with is the best when making food choices just had the trashiest creamy chicken sauce with basmati rice and i dont know how to feel well maybe not trashy its just not something im used to i no dey chop pass rice and stew	negative
pcm_train_00073	please i find it difficult to understand this space ehnneveryday every new morning different thingsee ehnn i know say luno own na savings una help me do see if una touch wálai i go cry my tired i seriously exhausted	negative
pcm_train_00074	am and i just finished studying my bank statement from jan march n e be like say dem consistently rob me omo make una just avoid me today abeg	negative
pcm_train_00075	lol checking different ig and whatsapp status this morning made me realize that i ought to really be going out enjoying clubbing and doing everything my age but then i remembered say na money dem dey use do those kain things	negative
pcm_train_00076	omo nigerian news agency no go kill me with bad news una no know say country hard nii make una dey throw in good news once in a while nau	negative
pcm_train_00077	na only me no gree baff soap and e come be like say i no serious for my life chai	negative
pcm_train_00078	abeg please wetin dey happen i havent eaten since morning because of you people and im not owing oooo	negative
pcm_train_00079	na so use thief my money oh make una help a broda abeg i don send mail tire access bank deserve dragging	negative
pcm_train_00080	futo babes ‍️ you sha not misbehave with dem cause dem dey burst bottle	negative
pcm_train_00081	i go soon break person head for this abuja una go stop me for road dey beg sir sir na craze	negative
pcm_train_00082	arsenal cant make the top with them westham leicester and co na football power house una wan dey face week in week out	negative
pcm_train_00083	she ws floggin me dat very day d beatin ws so much dat i try fight back nd dis man came rm nowhere omg i almost die dat daydat my head wey no correct full of koko nd my mom was there watching dat ws d last day she floggin me always sha obt i see hell return dat day	negative
pcm_train_00084	now chelsea don play and dem no win aswear the weekend don spoil for some fans e dey pain walahi	negative
pcm_train_00085	that guy wan body you for touching line ‍️‍️ hope say medic dey cause na outside him go finish this match	negative
pcm_train_00086	went to see mortal kombat at imax lekki e be like say subzero dey the cinema hall the main cold wey wan finish us ehn	negative
pcm_train_00087	guy i told this man my surname e shout e say taaa you get money na say my papa even grandpa made money alaye im jobless you wan make i dey buy beer every day gon meet my grandpa	negative
pcm_train_00088	why you dey thank me na you i dey greet wetin concern me concern you comot here	negative
pcm_train_00089	naso my crush tell me sey she love me today i con dey confess feelings too like mumu oo i don forget say today na april fools naso she tell me thanks con send one pawpaw laughing sticker	negative
pcm_train_00090	tailor wey i give jesus christ burial cloth make e sew later come dey cap me bobo like this now who naked better pass me	negative
pcm_train_00091	i subscribe gb una no go allow am last now again una dey use una network they test my patience atleast lemme enjoy the network now even if i wont enjoy my data	negative
pcm_train_00092	babes closeup na how much again i don use too many brands teeth no gree white na	negative
pcm_train_00093	a letter to my ex dear miss amaka you been tell me say ikechukwu na your brother all those years only for you to invite me come wedding come see you dey marry the same ikechukwu my chest still dey pain me till today for my leg and my abdomen region	negative
pcm_train_00094	e con be like say i no even dey do anything	negative
pcm_train_00095	and somebodys daughter thinks she go born pass one for me even that one sev make e no be like say person no born ni‍️ abeg i no fit stand these things women go through biko	negative
pcm_train_00096	omo see as women dey package weed chics stay doing shii better the idiot wey dey link me up needs to see this monkey banana	negative
pcm_train_00097	no light heat come dey againand our forever tenantmosquitoes dey also do their job which kind wahala be this	negative
pcm_train_00098	i know mention anybody name but if this na your fav sub help am catch am na only fan base wen know say their oga dey wear fake ice dey cry for my comment if you come for me i go for your unfortunate parents	negative
pcm_train_00099	fine girl = wahala and wahala no dey finish so dem dey fear us	negative
pcm_train_00100	make pple d dey very careful wit diz end of month oo month don end month don end ehhenn who tell u say month end nah pay day some pple month nah dayz abeg make una take am easy wit pple oo diz monin i hear wife dey corey wit husband ontop breakfast money	negative
pcm_train_00101	e b like una wan see crazy abi in voice abi since yesterday ur network has been fluctuating till now	negative
pcm_train_00102	mechanic no go get joy e go comot tyre remove b change plug knack spanner for your ba terminal buh you weh get caryou go de do am small smallyou go just open bonnetlook am look amclose am again	negative
pcm_train_00103	u want to see crazy e fe ri werey abi which kain oloriburuku bank be this tori oloun no story just refund my money oo im not banking with you people again is not me u will give bp	negative
pcm_train_00104	this bro no nice at all upon all dis message wey you dey hear im crying for you	negative
pcm_train_00105	lmao hin no dey see zero na e dey see	negative
pcm_train_00106	na me lie fan pass na me go put ac for highest na me sweat pass both hands and feet na me get sensitive skin pass na me cold catch pass its so bad dear lord i hand over this skinbody to you	negative
pcm_train_00107	one man was watching football with her wife and their son for one lounge like that madam say she wan go house baba say make she dey go na omo come see small marriage drama	negative
pcm_train_00108	boss bless me tonight abeg even if na any amount hungry wan finish me for where ahde	negative
pcm_train_00109	forex trading be like baba don put hand for head alot of persons make the mistake of opening multiple running trades abeg how you wan manage them without running mad	negative
pcm_train_00110	im thinking nkpe shey i should resume for lectures this week or not awon lecturers don threaten us down gan but im not mentally and physically ready	negative
pcm_train_00111	no wan pay their betwaytrivia winners and na kthat k fit feed me for week+ as a studentabeg help me and beg them e don red for me	negative
pcm_train_00112	all of una still dy fail with abt for na una dy shout the best oooo the best at least his album shouldnt be drowning	negative
pcm_train_00113	wahala be like nigeria e dey paint pesin black	negative
pcm_train_00114	they don dey talk about school love na only me no get love na only me no get love i hate this jov like wt he used to be a good boy o why e dey yab person until love	negative
pcm_train_00115	this life like they say no balance i follow wahala no dey finish and spent all my savings until account got empty now my eyes don clear	negative
pcm_train_00116	person wey dey ment he frustrated me tonite i almst broke my tv screen already celebrating goal was like wtf timo deserves to the sh i swear down how on heck my boiz gonna loose to macedonia for dat mata	negative
pcm_train_00117	where una dey see this money to chop four eggs eh this noodles looks terrible tho	negative
pcm_train_00118	wetin you go do if your friend baff you with dis kinda insult ‍️‍️ tag that friend wen e mouth dey run like dis and tune in to watch now as e dey show on top dstv channel and uhf terrestrial	negative
pcm_train_00119	one baba brought the gf to his friend shop to help monitor am if she can make a good wife madam come begin dey make mumu waka with ogas nwa boy now baba told the bros to come carry the woman comot him side abeg	negative
pcm_train_00120	who go cute soap for me bayi abi make i go learn yahoo ni becus i don tire oh even survivalfund i dey hope on no wan pay at this age make person account still dey read minus ìlú yìí shumi	negative
pcm_train_00121	if i dey play ball i dey avoid these kind people i no dey bother my sef to go mack them theyll just use you and shine	negative
pcm_train_00122	wo e be like say this boy go dropout o school fees don dey strangulate me me wey drop out no get two heads o	negative
pcm_train_00123	be like i came to church very early o sermon no wan end and my stomach don dey para	negative
pcm_train_00124	wahala be like bicycle ooooo kuje rain don commot person roof breeze carry roof hit person windshield spoil d person gate breeze lift roof again to spoil another person house god abeg they still dey commot money for this house	negative
pcm_train_00125	omo una dey mad oh na love be this	negative
pcm_train_00126	hei lawd na so man wan take miss e blessing could even be that baba lack data or has a dead phone battery	negative
pcm_train_00127	all my friends don get peaches for georgiae con be like sey na only me no serious with my life	negative
pcm_train_00128	where una dey see these twins dey born congrats bells we tap into this double blessings	negative
pcm_train_00129	make we talk about nigeriafrance relations who else fit shook mouth on top de mata on how france won take support de nigerian creative industry oda than the french minister delegate for foreign trade and economic attractiveness	negative
pcm_train_00130	to like e person no b crime i de try let you knw wetin de my mind you driving me crazy	negative
pcm_train_00131	im in tears guys see how my customer is rocking her bag she made me so happy with this picture e choke abi e no choke lagos nigeria	negative
pcm_train_00132	we sef chop life make e no come be like say we no do anything but we arent kids anymore so we gotta grow up	negative
pcm_train_00133	im in tears guys see how my customer rocked her bag she made me so happy with this picture e choke abi e no choke ikeja	negative
pcm_train_00134	today bin wan get kleg but my god no gree im glad today ended on a good note and im feeling so elated rn thank you jesus	negative
pcm_train_00135	am sure the person who discovered milk was a male but im wondering what he was doing with the cows breast before he realized there was milk dat whatsapp friend dat loves me and have not seen me yet i love you	negative
pcm_train_00136	i had to remind my tailor to allow me breathe because this waist snatching is becoming something else please my dear let me breathe na who dey alive dey wear asoebi	negative
pcm_train_00137	this work of is going to cost me more hours to complete and im not giving up not now or never ️ so many legends dey but im just trying to be another one please kindly retweet for a bother na	negative
pcm_train_00138	quick question how una dey live this life without jesus shey e sweet ni you for calm down meet jesus oo	negative
pcm_train_00139	i get wise friends abeg ola told me something remarkable lately he was like bruh abeg in all you do pls end up with a kind partner because there are days when love wont be enough but you see a kind partner ehn heshe will be kind to you regardless i don die	negative
pcm_train_00140	done turn rich friend oooooo abeg where una dey see this money	negative
pcm_train_00141	where are you people seeing all these true love youre doing na me too im finding na help me to find na	negative
pcm_train_00142	baba spread this funds make dem fit dey charge me this kind maintenance fee	negative
pcm_train_00143	gaskiya na sha wahala na bils they call me attention seeker e choke	negative
pcm_train_00144	e wetin e strangulate congratulations dorathy congratulations otititi congratulations life size doll	negative
pcm_train_00145	where una dey find this love abeg if you help me see	negative
pcm_train_00146	bros abeg nau just tell her your younger brother likes one of her friends pick anyone wey be my spec and say na she i like bikonu	negative
pcm_train_00147	e dey do me like make friday just come im tired of here already	negative
pcm_train_00148	lmao not chisom i been dey look when dem dey drag you	negative
pcm_train_00149	stop tell me i forget you pls that have to stop remember when you dey suffer i know come help you and u know call me enjoyment come ur side my phone no ring oh now d table don turn i don become ur enemy life	negative
pcm_train_00150	if you go to that party behind metheyll not give you rice chop and if them give you rice meat know go dey on top ami hate rubbish‍️now im just home alone looking like person wey lost her way to naija abeg who get party for there area lemme turn up please	negative
pcm_train_00151	you go dey hear so the oxygen go con meet the methyl group con form leaving group sha the end product na secondary alchohol shey you get bro i no get	negative
pcm_train_00152	dis boys av dual citizenshipno properties nor businesses in nigeria bt ar makin d loudest noises and ar causin problem in d country dey can leave d country anytime dey set it ablaze wt d help of sentimental apologists dey av turned some of our youths zombies wt no brains	negative
pcm_train_00153	be there exposing the faux elite like us wey no get money see as you don tension streets na soso lol dey my tl like i saidzo ka ba mu	negative
pcm_train_00154	my mum just told me hope im aware my dad wont follow me to another church to do my wedding so let my head be correct buy the men in my church their head isnt correct sef i don enter this one i need to escape	negative
pcm_train_00155	am ur biggest fan person blow me for mouth coz of you we dey argue u and olamide who get vibes pass i argue they tell dem sey na get vibes pass before u no wetin dey happen wey don dey argue i no know wen i call the boy bastard out of anger the guy blow me	negative
pcm_train_00156	how far after the online bashing na this way una go una dey hawk our jersey like this cc	negative
pcm_train_00157	maka chineke nna bi neligwe the sun outside eh ‍️ if na you dey commit the sin wey make heaven dey vex lidis stop it please	negative
pcm_train_00158	you wey know like joke dem no dey give me money	negative
pcm_train_00159	this modric goal was one real madrid goal i didnt celebrate dem just ruin handicap wey everything don set	negative
pcm_train_00160	the kind body heating wey dis geh gimme for bus now ehn unto say i look like snow white shey na my fault	negative
pcm_train_00161	person way promise me christmas money na him dey flash me bayiii but sha all thos students wey dey write pages of answer for question una too no fit make heaven oo which mark u want make dem give us wey write	negative
